{"schema":"rafaelia.workflow-session.v1","session_id":"RAFAELIA.WORKFLOW.20260716.001","title":"Omega longitudinal workflow and thirty support layers","observed_at":"2026-07-16T16:00:00-03:00","cycle":["PSI_INTENT","CHI_OBSERVE","RHO_NOISE","DELTA_TRANSFORM","SIGMA_CUSTODY","OMEGA_CLOSE","PSI_REOPEN"],"scope":{"question":"How can sessions, repositories, semantics and evidence be reviewed repeatedly without becoming loose repetition?","completion_criterion":"A machine-readable index, validated session contract, semantic glossary, executable gate and tests exist on one integration branch.","repositories":["rafaelmeloreisnovo/RafGitTools"],"paths":["workflow-master-index.json","docs/","schemas/","scripts/","examples/","tests/"]},"semantic_anchors":[{"id":"A001","text":"coerência verificável","kind":"TERM","source_ref":"docs/WORKFLOW_MASTER_INDEX_RAFAELIA.md"},{"id":"A002","text":"símbolo preservado + prova registrada + execução auditável","kind":"RELATION","source_ref":"docs/WORKFLOW_MASTER_INDEX_RAFAELIA.md"},{"id":"A003","text":"TOKEN_VAZIO is not zero","kind":"NEGATION","source_ref":"docs/SEMANTIC_INVARIANT_GLOSSARY.md"},{"id":"A004","text":"Omega is provisional closure, not universal truth","kind":"EXCEPTION","source_ref":"docs/SEMANTIC_INVARIANT_GLOSSARY.md"}],"claims":[{"id":"C001","statement":"The longitudinal session contract is validated by a deterministic dependency-free Python parser.","kind":"METHOD","state":"VERIFIED","domain":"RafGitTools workflow metadata","verification_mode":"TEST","evidence_refs":["E003","E004"],"test_refs":["T001"],"contradiction_refs":[]},{"id":"C002","statement":"Thirty support layers provide useful current coverage for the RAFAELIA transdisciplinary workflow.","kind":"HYPOTHESIS","state":"PARTIAL","domain":"Current RAFAELIA repository and session corpus","verification_mode":"OBSERVATION","evidence_refs":["E001","E002"],"test_refs":[],"contradiction_refs":["X001"],"reason":"Future evidence may require new or split layers."},{"id":"C003","statement":"Omega denotes provisional closure with explicit reopening into a new observation cycle.","kind":"SYMBOL","state":"DECLARED","domain":"RAFAELIA workflow semantics","verification_mode":"DOCUMENT","evidence_refs":["E002"],"test_refs":[],"contradiction_refs":[]},{"id":"C004","statement":"The new contract can be executed without creating another GitHub Actions workflow file.","kind":"METHOD","state":"VERIFIED","domain":"Repository orchestration","verification_mode":"TEST","evidence_refs":["E003","E004"],"test_refs":["T001"],"contradiction_refs":[]},{"id":"C005","statement":"Release artifact hashes for this documentation and validator set are available.","kind":"EVIDENCE","state":"TOKEN_VAZIO","domain":"Artifact promotion","verification_mode":"NONE","evidence_refs":[],"test_refs":[],"contradiction_refs":[],"reason":"Hashes are generated only after the branch artifacts are built or exported."}],"invariants":[{"id":"I001","statement":"The master index contains exactly thirteen modules and thirty uniquely identified support layers.","transformations":["JSON parse","key reorder","validation rerun"],"status":"VERIFIED","evidence_refs":["E001","E003","E004"]},{"id":"I002","statement":"A TOKEN_VAZIO value remains distinct from zero, success, proof and absence of existence.","transformations":["session serialization","summary generation"],"status":"VERIFIED","evidence_refs":["E002","E003","E004"]},{"id":"I003","statement":"The same valid session produces the same validation decision under the same Python semantics.","transformations":["repeat validator execution"],"status":"PARTIAL","evidence_refs":["E003","E004"],"reason":"Cross-version and cross-platform replication remains pending."}],"evidence":[{"id":"E001","type":"FILE","locator":"workflow-master-index.json","observed_at":"2026-07-16T16:00:00-03:00","digest":"TOKEN_VAZIO","notes":"Machine-readable authority for modules and support layers."},{"id":"E002","type":"FILE","locator":"docs/WORKFLOW_MASTER_INDEX_RAFAELIA.md","observed_at":"2026-07-16T16:00:00-03:00","digest":"TOKEN_VAZIO","notes":"Human-readable longitudinal workflow."},{"id":"E003","type":"FILE","locator":"scripts/workflow_session_contract.py","observed_at":"2026-07-16T16:00:00-03:00","digest":"TOKEN_VAZIO","notes":"Dependency-free deterministic validator."},{"id":"E004","type":"TEST_REPORT","locator":"tests/test_workflow_session_contract.py","observed_at":"2026-07-16T16:00:00-03:00","digest":"TOKEN_VAZIO","notes":"Unit tests for cross-reference and promotion invariants."},{"id":"E005","type":"FILE","locator":"runtime-lock.json","observed_at":"2026-07-16T16:00:00-03:00","digest":"TOKEN_VAZIO","notes":"Existing source provenance contract."},{"id":"E006","type":"POLICY","locator":".github/copilot-instructions.md","observed_at":"2026-07-16T16:00:00-03:00","digest":"TOKEN_VAZIO","notes":"Existing governance and repository boundaries."}],"tests":[{"id":"T001","command":"python3 -m unittest discover -s tests -p 'test_workflow_session_contract.py' -v","result":"PASS","supports_claims":["C001","C004"],"evidence_ref":"E004","notes":"Local contract suite."}],"contradictions":[{"id":"X001","statement_a":"The thirty layers are sufficient for the current mapped workflow.","statement_b":"A future domain may reveal a missing or over-compressed layer.","state":"SCOPE_SPLIT","resolution":"Treat 30 as versioned v1 coverage, not universal closure.","evidence_refs":["E001","E002"]}],"token_vazio":[{"id":"V001","field":"claims.C005","reason":"No release artifact has been promoted for this branch yet.","promotion_condition":"Generate artifacts and record concrete SHA-256 values."},{"id":"V002","field":"modules.M01.canonical_repository","reason":"A single canonical repository for the symbolic RAFAELIA layer has not been demonstrated.","promotion_condition":"Select and document one source-of-truth repository."}],"support_layers":[{"id":"S01","status":"PASS","reason":"Original request and workflow sources are referenced.","evidence_refs":["E002"]},{"id":"S02","status":"PASS","reason":"Canonical glossary defines symbols and non-equivalences.","evidence_refs":["E002"]},{"id":"S03","status":"PASS","reason":"Claims are atomized with stable IDs.","evidence_refs":["E003"]},{"id":"S04","status":"PASS","reason":"Each claim carries kind, state and verification mode.","evidence_refs":["E003"]},{"id":"S05","status":"PASS","reason":"Claims and invariants declare domains and transformations.","evidence_refs":["E003"]},{"id":"S06","status":"NOT_APPLICABLE","reason":"This session defines metadata contracts rather than a physical dimensional equation.","evidence_refs":[]},{"id":"S07","status":"PARTIAL","reason":"Formal validation rules are explicit; a machine-checked mathematical proof is outside this session.","evidence_refs":["E003"]},{"id":"S08","status":"PARTIAL","reason":"Workflow invariants are encoded, while the geometric family remains delegated to domain papers.","evidence_refs":["E001","E002"]},{"id":"S09","status":"PASS","reason":"Missing layers, references or promotion evidence produce explicit failure.","evidence_refs":["E003","E004"]},{"id":"S10","status":"NOT_APPLICABLE","reason":"No model-performance claim is compared in this contract session.","evidence_refs":[]},{"id":"S11","status":"PASS","reason":"Evidence items carry locator and observation time.","evidence_refs":["E003"]},{"id":"S12","status":"PASS","reason":"The existing runtime-lock remains the source provenance authority.","evidence_refs":["E005"]},{"id":"S13","status":"TOKEN_VAZIO","reason":"Branch artifacts have not yet been promoted and hashed.","evidence_refs":[]},{"id":"S14","status":"PASS","reason":"Validation is deterministic for identical JSON and interpreter semantics.","evidence_refs":["E003","E004"]},{"id":"S15","status":"NOT_APPLICABLE","reason":"No numerical iterative attractor is evaluated in this session.","evidence_refs":[]},{"id":"S16","status":"NOT_APPLICABLE","reason":"No approximate numerical result is promoted here.","evidence_refs":[]},{"id":"S17","status":"PARTIAL","reason":"The parser is platform-neutral Python; Android, Termux and multiple Python versions remain to be exercised.","evidence_refs":["E003"]},{"id":"S18","status":"PASS","reason":"The parser uses bounded metadata objects and no external dependency.","evidence_refs":["E003","E004"]},{"id":"S19","status":"PASS","reason":"Repository policy and explicit typed contracts remain authoritative.","evidence_refs":["E006"]},{"id":"S20","status":"PASS","reason":"The example contains no credentials or private corpus payload.","evidence_refs":["E006"]},{"id":"S21","status":"PASS","reason":"The governance layer retains hard protection as a required support category.","evidence_refs":["E001","E006"]},{"id":"S22","status":"PASS","reason":"Unknowns are represented in a dedicated TOKEN_VAZIO ledger.","evidence_refs":["E002","E003"]},{"id":"S23","status":"PASS","reason":"The session preserves a scope-split contradiction instead of deleting it.","evidence_refs":["E003"]},{"id":"S24","status":"PASS","reason":"Commands, files and schema are recorded for repetition.","evidence_refs":["E002","E003","E004"]},{"id":"S25","status":"PASS","reason":"Unit tests cover valid and invalid contract states.","evidence_refs":["E004"]},{"id":"S26","status":"PASS","reason":"Promotion states and blockers are explicit.","evidence_refs":["E001","E002","E003"]},{"id":"S27","status":"PARTIAL","reason":"Validator output names failure fields; structured JSON output can be added later.","evidence_refs":["E003"]},{"id":"S28","status":"TOKEN_VAZIO","reason":"This metadata-only change does not yet define a persisted checkpoint artifact.","evidence_refs":[]},{"id":"S29","status":"PASS","reason":"Stable IDs link claims, evidence, tests, layers and artifacts.","evidence_refs":["E003","E004"]},{"id":"S30","status":"PARTIAL","reason":"The cross-domain boundary is defined; independent domain replications remain pending.","evidence_refs":["E001","E002"]}],"artifact